<?xml version="1.0" encoding="UTF-8"?>
<xs:schema xmlns:xs="http://www.w3.org/2001/XMLSchema">
	<xs:element name="list">
		<xs:complexType>
			<xs:sequence minOccurs="0" maxOccurs="unbounded">
				<xs:element name="general" minOccurs="0" maxOccurs="unbounded">
					<xs:complexType>
						<xs:sequence minOccurs="0" maxOccurs="unbounded">
							<xs:element name="player" minOccurs="0" maxOccurs="unbounded">
								<xs:complexType>
									<xs:sequence minOccurs="1" maxOccurs="unbounded">
										<xs:element name="class" minOccurs="0" maxOccurs="unbounded">
											<xs:complexType>
												<xs:sequence minOccurs="1" maxOccurs="unbounded">
													<xs:element name="set" minOccurs="1" maxOccurs="unbounded">
														<xs:complexType>
															<xs:attribute name="name" type="xs:string" />
															<xs:attribute name="value" type="xs:string" />
														</xs:complexType>
													</xs:element>
												</xs:sequence>
												<xs:attribute name="id" type="xs:integer" />
											</xs:complexType>
										</xs:element>
									</xs:sequence>
								</xs:complexType>
							</xs:element>
							<xs:element name="summon" minOccurs="0" maxOccurs="unbounded">
								<xs:complexType>
									<xs:sequence minOccurs="1" maxOccurs="unbounded">
										<xs:element name="set" minOccurs="1" maxOccurs="unbounded">
											<xs:complexType>
												<xs:attribute name="name" type="xs:string" />
												<xs:attribute name="value" type="xs:string" />
											</xs:complexType>
										</xs:element>
									</xs:sequence>
								</xs:complexType>
							</xs:element>
						</xs:sequence>
					</xs:complexType>
				</xs:element>
				<xs:element name="olympiad" minOccurs="0" maxOccurs="unbounded">
					<xs:complexType>
						<xs:sequence minOccurs="0" maxOccurs="unbounded">
							<xs:element name="player" minOccurs="0" maxOccurs="unbounded">
								<xs:complexType>
									<xs:sequence minOccurs="1" maxOccurs="unbounded">
										<xs:element name="class" minOccurs="0" maxOccurs="unbounded">
											<xs:complexType>
												<xs:sequence minOccurs="1" maxOccurs="unbounded">
													<xs:element name="set" minOccurs="1" maxOccurs="unbounded">
														<xs:complexType>
															<xs:attribute name="name" type="xs:string" />
															<xs:attribute name="value" type="xs:string" />
														</xs:complexType>
													</xs:element>
												</xs:sequence>
												<xs:attribute name="id" type="xs:integer" />
											</xs:complexType>
										</xs:element>
									</xs:sequence>
								</xs:complexType>
							</xs:element>
							<xs:element name="summon" minOccurs="0" maxOccurs="unbounded">
								<xs:complexType>
									<xs:sequence minOccurs="1" maxOccurs="unbounded">
										<xs:element name="set" minOccurs="1" maxOccurs="unbounded">
											<xs:complexType>
												<xs:attribute name="name" type="xs:string" />
												<xs:attribute name="value" type="xs:string" />
											</xs:complexType>
										</xs:element>
									</xs:sequence>
								</xs:complexType>
							</xs:element>
						</xs:sequence>
					</xs:complexType>
				</xs:element>
			</xs:sequence>
		</xs:complexType>
	</xs:element>
</xs:schema>